"Sentence","Meaning","Phonetic","My Phonetic","Audio","My Audio"
"First of all, let me get something straight","Primero que todo permítame aclarar algo","fɜrst əv ɔl, lɛt mi gɛt ˈsʌmθɪŋ streɪt","fɜrsd af ol, let mi get ˈsʌmθɪŋ streɪT","First of all, let me get something straight.mp3","First of all, let me get something straight.m4a"
"This is a journal, not a diary","Esto es cuaderno de notas, no a diario","ðɪs ɪz ə ˈʤɜrnəl, nɑt ə ˈdaɪəri","dɪszzə ˈjərnəl, nadə ˈdaɪəri","This is a journal, not a diary.mp3","This is a journal, not a diary.m4a"
"I know what it says on the cover","Se lo que dice la portada","aɪ noʊ wʌt ɪt sɛz ɑn ðə ˈkʌvər","aɪ noʊ wət ɪt sez ɑn ðə ˈkʌvər","I know what it says on the cover.mp3","I know what it says on the cover.m4a"
"but when Mom went out to buy this","Pero cuando mama fue a comprar esta cosa","bʌt wɛn mɑm wɛnt aʊt tu baɪ ðɪs θɪŋ","bət wən mɑm wɛndaʊt tə baɪ ðɪs θɪŋ","but when Mom went out to buy this thing.mp3","but when Mom went out to buy this thing.m4a"
"I specifically told her to get one that didn't say diary on it.","Yo especificamente le dijie a ella que no comprara uno que dijie diario","aɪ spəˈsɪfɪkli toʊld hɜr tu gɛt wʌn ðæt ˈdɪdənt seɪ ˈdaɪəri ɑn ɪt.","aɪ spəˈsɪfɪkli toʊld hɜr tə gɛt wʌn ðæt ˈdɪdənt seɪ ˈdaɪəri ɑn ɪt.","I specifically told her to get one that didn't say diary on it..mp3","I specifically told her to get one that didn't say diary on it.m4a"